{
  "$schema": "http://json-schema.org/draft-07/schema#",
  "title": "Metadata",
  "description": "SHUOSC图书元信息",
  "type": "object",
  "properties": {
    "isbn": {
      "description": "ISBN号",
      "type": "string",
      "pattern": "^978\\d{10}$"
    },
    "title": {
      "description": "题名",
      "type": "string"
    },
    "parallelTitle": {
      "description": "并列题名",
      "type": [
        "string",
        "null"
      ]
    },
    "seriesTitle": {
      "description": "丛书名",
      "type": [
        "string",
        "null"
      ]
    },
    "author": {
      "description": "责任者",
      "type": "string"
    },
    "languageCode": {
      "description": "正文语种",
      "type": "string",
      "pattern": "^[a-z]{3}$"
    },
    "description": {
      "description": "内容简介",
      "type": "string"
    },
    "publisher": {
      "description": "出版社",
      "type": "string"
    },
    "clcNumber": {
      "description": "中图分类号",
      "type": [
        "string",
        "null"
      ]
    },
    "publicationDate": {
      "description": "出版时间",
      "type": "string",
      "pattern": "^\\d{4}-(0\\d|1[012])$"
    },
    "pricing": {
      "description": "定价",
      "type": "string",
      "pattern": "^([1-9]\\d*|0)\\.\\d{2}$"
    },
    "totalPages": {
      "description": "页数",
      "type": "string",
      "pattern": "^[1-9]\\d*$"
    },
    "binding": {
      "description": "装帧",
      "type": "string"
    },
    "suitFlag": {
      "type": "boolean"
    }
  },
  "required": [
    "isbn",
    "title",
    "parallelTitle",
    "seriesTitle",
    "author",
    "languageCode",
    "description",
    "publisher",
    "clcNumber",
    "publicationDate",
    "pricing",
    "totalPages",
    "binding",
    "suitFlag"
  ],
  "additionalProperties": false
}