{
  "isbn": "9787111251217",
  "title": "编译原理 (第2版)",
  "parallelTitle": "Compilers: Principles, Techniques, and Tools",
  "seriesTitle": "计算机科学丛书",
  "author": "[美] Alfred V. Aho, Monica S. Lam, Ravi Sethi 著; 赵建华, 郑滔, 戴新宇 译",
  "languageCode": "chi",
  "description": "本书全面、深入地探讨了编译器设计方面的重要主题，包括词法分析、语法分析、语法制导定义和语法制导翻译、运行时刻环境、目标代码生成、代码优化技术、并行性检测以及过程间分析技术，并在相关章节中给出大量实例。",
  "publisher": "机械工业出版社",
  "clcNumber": "TP314",
  "publicationDate": "2009-01",
  "pricing": "89.00",
  "totalPages": "631",
  "binding": "平装",
  "suitFlag": false
}
