{
  "isbn": "9787115516756",
  "title": "UNIX环境高级编程 (第3版)",
  "parallelTitle": "Advanced Programming in the UNIX Environment",
  "seriesTitle": null,
  "author": "[美] W. Richard Stevens, Stephen A. Rago 著; 戚正伟, 张亚英, 尤晋元 译",
  "languageCode": "chi",
  "description": "书中除了介绍UNIX文件和目录、标准I/O库、系统数据文件和信息、进程环境、进程控制、进程关系、信号、线程、线程控制、守护进程、各种I/O、进程间通信、网络IPC、伪终端等方面的内容，还在此基础上介绍了众多应用实例，包括如何创建数据库函数库以及如何与网络打印机通信等。此外，还在附录中给出了函数原型和部分习题的答案。",
  "publisher": "人民邮电出版社",
  "clcNumber": "TP316.81",
  "publicationDate": "2019-10",
  "pricing": "169.00",
  "totalPages": "812",
  "binding": "平装",
  "suitFlag": false
}
