{
  "isbn": "9787111666073",
  "title": "现代操作系统: 原理与实现",
  "parallelTitle": null,
  "seriesTitle": "计算机类专业系统能力培养系列教材",
  "author": "陈海波, 夏虞斌 著",
  "languageCode": "chi",
  "description": "本书以三个“面向”为导向，即面向经典基础理论与方法，面向国际前沿研究，面向最新工业界实践，深入浅出地介绍操作系统的理论、架构、设计方法与具体实现。本书是首本以ARM64为主体介绍操作系统的教材，将学术前沿与工业实践充分结合,不仅介绍了现有的Linux宏内核操作系统架构，而且介绍了微内核、外核等操作系统架构。本书共分为三个部分，其中第一部分(操作系统基础)以纸质版的形式出版，第二部分（操作系统进阶）和第三部分（ChCore课程实验）则以电子版的形式在本书网站发布。第一部分共分为11章，内容包括：操作系统概述、硬件结构、操作系统结构、内存管理、进程与线程、操作系统调度、进程间通信、同步原语、文件系统与存储、设备管理和系统虚拟化。本书包含大量插图、示例和练习，并融入了典型的操作系统相关的技术问题，既可以作为高等院校计算机专业本科生和研究生的操作系统课程教材，也可以作为工业界从事操作系统相关领域研发工作的专业人员的参考书。",
  "publisher": "机械工业出版社",
  "clcNumber": "TP316",
  "publicationDate": "2020-10",
  "pricing": "79.00",
  "totalPages": "376",
  "binding": "平装",
  "suitFlag": false
}