{
  "isbn": "9787121181184",
  "title": "编码: 隐匿在计算机软硬件背后的语言",
  "parallelTitle": "Code: The Hidden Language of Computer Hardware and Software",
  "seriesTitle": "传世经典书丛",
  "author": "[美] Charles Petzold 著; 左飞, 薛佟佟 译",
  "languageCode": "chi",
  "description": "本书是一本讲述计算机工作原理的书。不过，你千万不要因为“工作原理”之类的字眼就武断地认为，它是晦涩而难懂的。作者用丰富的想象和清晰的笔墨将看似繁杂的理论阐述得通俗易懂，你丝毫不会感到枯燥和生硬。更重要的是，你会因此而获得对计算机工作原理较深刻的理解。这种理解不是抽象层面上的，而是具有一定深度的，这种深度甚至不逊于“电气工程师”和“程序员”的理解。",
  "publisher": "电子工业出版社",
  "clcNumber": "TP3-0",
  "publicationDate": "2012-10",
  "pricing": "59.00",
  "totalPages": "420",
  "binding": "平装",
  "suitFlag": false
}