{
  "isbn": "9787111617778",
  "title": "TCP/IP详解 卷3: TCP事务协议、HTTP、NNTP和UNIX域协议",
  "parallelTitle": "TCP/IP Illustrated, Volume 3: TCP for Transactions, HTTP, NNTP, and the UNIX Domain Protocols",
  "seriesTitle": "计算机科学丛书",
  "author": "[美] Gary R. Wright, W. Richard Stevens 著; 胡谷雨, 吴礼发 等译",
  "languageCode": "chi",
  "description": "本书是三卷本套书《TCP/IP详解》的第3卷，主要内容包括：TCP事务协议，即T/TCP，这是对TCP的扩展，使客户-服务器事务更快、更高效和更可靠；TCP/IP应用，主要是HTTP和NNTP；Unix域协议，这些协议提供了进程之间通信的一种手段，当客户与服务器进程在同一台主机上时，Unix域协议通常要比TCP/IP快1倍。本书同样采用了大量的实例和实现细节，并参考引用了卷2中的大量源程序。",
  "publisher": "机械工业出版社",
  "clcNumber": "TN915.04",
  "publicationDate": "2019-03",
  "pricing": "59.00",
  "totalPages": "266",
  "binding": "平装",
  "suitFlag": true
}