{
  "isbn": "9787115400512",
  "title": "程序员的数学 2: 概率统计",
  "parallelTitle": null,
  "seriesTitle": "图灵程序设计丛书",
  "author": "[日] 平冈和幸, 堀玄 著; 陈筱烟 译",
  "languageCode": "chi",
  "description": "本书沿袭《程序员的数学》平易近人的风格，用通俗的语言和具体的图表深入讲解程序员必须掌握的各类概率统计知识，例证丰富，讲解明晰，且提供了大量扩展内容，引导读者进一步深入学习。 本书涉及概率变量、贝叶斯公式、离散型概率分布、连续型概率分布、伪随机数、协方差矩阵、估计检验以及与之相关的各类应用。",
  "publisher": "人民邮电出版社",
  "clcNumber": "TP301.6",
  "publicationDate": "2015-09",
  "pricing": "79.00",
  "totalPages": "405",
  "binding": "平装",
  "suitFlag": true
}
