{
  "isbn": "9787115293688",
  "title": "程序员的数学",
  "parallelTitle": null,
  "seriesTitle": "图灵程序设计丛书",
  "author": "[日] 结城浩 著; 管杰 译",
  "languageCode": "chi",
  "description": "本书面向程序员介绍了编程中常用的数学知识，借以培养初级程序员的数学思维。书中讲解了二进制计数法、逻辑、余数等许多与编程密切相关的数学方法，分析了哥尼斯堡七桥问题、汉诺塔、斐波那契数列等经典问题和算法，引导读者深入理解编程中的数学方法和思路。",
  "publisher": "人民邮电出版社",
  "clcNumber": "TP301.6",
  "publicationDate": "2012-10",
  "pricing": "49.00",
  "totalPages": "232",
  "binding": "平装",
  "suitFlag": true
}
