{
  "isbn": "9787111618331",
  "title": "设计模式: 可复用面向对象软件的基础 (典藏版)",
  "parallelTitle": "Design Patterns: Elements of Reusable Object-Oriented Software",
  "seriesTitle": "计算机科学丛书",
  "author": "[美] Erich Gamma, Richard Helm, Ralph Johnson, John Vlissides 著; 李英军, 马晓星, 蔡敏, 刘建中 等译",
  "languageCode": "chi",
  "description": "本书结合设计实例从面向对象的设计中精选出23个设计模式, 总结了面向对象设计中颇有价值的经验, 并且用简洁可复用的形式表达出来。本书分类描述了一组设计良好、 表达清楚的软件设计模式, 这些模式在实用环境下特别有用。 本书适合大学计算机专业的学生、研究生及相关人员参考。",
  "publisher": "机械工业出版社",
  "clcNumber": "TP312.8",
  "publicationDate": "2019-05",
  "pricing": "79.00",
  "totalPages": "290",
  "binding": "平装",
  "suitFlag": false
}
