{
  "isbn": "9787121149528",
  "title": "深度探索C++对象模型",
  "parallelTitle": "Inside the C++ Object Model",
  "seriesTitle": "传世经典书丛",
  "author": "[美] Stanley B. Lippman 著; 侯捷 译",
  "languageCode": "chi",
  "description": "Inside The C++ Object Model专注于C++对象导向程序设计的底层机制，包括结构式语意、暂时性对象的生成、封装、继承，以及虚拟——虚拟函数和虚拟继承。这本书让你知道：一旦你能够了解底层实现模型，你的程序代码将获得多么大的效率。Lippman澄清了那些关于C++额外负荷与复杂度的各种错误信息和迷思，但也指出其中某些成本和利益交换确实存在。他阐述了各式各样的实现模型，指出它们的进化之道及其本质因素。本书涵盖了C++对象模型的语意暗示，并指出这个模型是如何影响你的程序的。",
  "publisher": "电子工业出版社",
  "clcNumber": "TP312",
  "publicationDate": "2011-12",
  "pricing": "69.00",
  "totalPages": "320",
  "binding": "平装",
  "suitFlag": false
}