{
  "isbn": "9787111670513",
  "title": "编程与类型系统",
  "parallelTitle": "Programming with Types: Examples in TypeScript",
  "seriesTitle": "华章程序员书库",
  "author": "[美] Vlad Riscutia 著; 赵利通 译",
  "languageCode": "chi",
  "description": "本书旨在告诉读者如何使用类型系统编写更好、更安全的代码，全面介绍类型系统的特性，主要内容包括类型和类型系统简介、基本类型、类型组合、类型安全、函数类型及其高级应用、子类型和类型兼容、面向对象编程的关键元素、泛型数据结构、泛型算法和迭代器、高阶类型等。本书没有关注这些特性背后的理论，而是通过实际应用的方式来解释每种特性，说明如何以及何时使用每种特性来改进代码。本书适合具备一定面向对象编程经验的读者阅读。",
  "publisher": "机械工业出版社",
  "clcNumber": "TP311.1",
  "publicationDate": "2021-01",
  "pricing": "119.00",
  "totalPages": "298",
  "binding": "平装",
  "suitFlag": false
}