{
  "isbn": "9787519817749",
  "title": "Effective Modern C++: 42招独家技巧助您改善C++11和C++14的高效用法 (中文版)",
  "parallelTitle": "Effective Modern C++",
  "seriesTitle": null,
  "author": "[美] Scott Meyers 著; 高博 译",
  "languageCode": "chi",
  "description": "想要彻底理解C++11和C++14，不可止步于熟悉它们引入的语言特性（例如，auto型别推导、移动语义、lambda表达式以及并发支持）。挑战在于高效地运用这些特性——从而使你的软件具备正确性、高效率、可维护性和可移植性。这正是这本实用的图书意欲达成的定位。它描述的正是使用C++11和C++14（即现代C++）来撰写真正卓越的软件之道。涵盖以下主题:大括号初始化、noexcept规格、完美转发，以及智能指针的make函数的优缺点。std::move、std::forward、右值引用和万能引用之间的联系。撰写整洁、正确，以及高效的lambda表达式的方法。std::atomic和volatile有怎样的区别，它们分别用于什么场合，以及它们和C++的并发API有何联系。“旧”C++程序设计（即C++98）中的最佳实战要求在现代C++的软件开发中作出哪些修订。",
  "publisher": "中国电力出版社",
  "clcNumber": "TP312.8",
  "publicationDate": "2018-02",
  "pricing": "99.00",
  "totalPages": "290",
  "binding": "平装",
  "suitFlag": false
}