{
  "isbn": "9787302392644",
  "title": "人月神话 (40周年中文纪念版)",
  "parallelTitle": "The Mythical Man-Month: Essays on Software Engineering",
  "seriesTitle": null,
  "author": "[美] Frederick P. Brooks, Jr. 著; UML China翻译组, 汪颖 译",
  "languageCode": "chi",
  "description": "在软件领域，很少能有像《人月神话》一样具有深远影响力并且畅销不衰的著作。该书英文原版一经面世，即引起业内人士的强烈反响，后又译为德、法、日、俄中等多种语言，全球销量数百万册。在本书第一次出版38年后的今天，我们重新整理了Brooks博士的经典内容，并将国内、国外软件开发领域先行者们对《人月神话》中的实践及系统理论的使用经验和心得集结成册与大家共享，更使本书成为国内从业者的必读经典之一。",
  "publisher": "清华大学出版社",
  "clcNumber": "TP311.5",
  "publicationDate": "2015-04",
  "pricing": "68.00",
  "totalPages": "392",
  "binding": "平装",
  "suitFlag": false
}