{
  "isbn": "9787115517807",
  "title": "UNIX网络编程 卷2: 进程间通信 (第2版)",
  "parallelTitle": "UNIX Network Programming, Volume 2: Interprocess Communications",
  "seriesTitle": null,
  "author": "[美] W. Richard Stevens 著",
  "languageCode": "chi",
  "description": "本书是一部UNIX网络编程的经典之作！进程间通信（IPC）几乎是所有Unix程序性能的关键，理解IPC也是理解如何开发不同主机间网络应用程序的必要条件。本书从对Posix IPC 和System V IPC的内部结构开始讨论，全面深入地介绍了4种IPC形式：消息传递、同步、共享内存及远程过程调用。本书内容详尽且具权威性，几乎每章都提供精选的习题，并提供了部分习题的答案。",
  "publisher": "人民邮电出版社",
  "clcNumber": "TP316.81",
  "publicationDate": "2019-12",
  "pricing": "109.00",
  "totalPages": "417",
  "binding": "平装",
  "suitFlag": true
}