{
  "isbn": "9787121123320",
  "title": "Effective C++: 改善程序与设计的55个具体做法 (第三版)",
  "parallelTitle": "Effective C++: 55 Specific Ways to Improve Your Programs and Designs",
  "seriesTitle": "传世经典书丛",
  "author": "[美] Scott Meyers 著; 侯捷 译",
  "languageCode": "chi",
  "description": "本书不是读完一遍就可以束之高阁的快餐读物，也不是用以解决手边问题的参考手册，而是需要您去反复阅读体会的，C++是真正程序员的语言，背后后精神的思想与无以伦比的表达能力，这使得它具有类似宗教般的魅力。希望这本书能够帮您跨越C++的重重险阻，领略高处才有的壮美风光，做一个成功而快乐的C++程序员。",
  "publisher": "电子工业出版社",
  "clcNumber": "TP312",
  "publicationDate": "2011-01",
  "pricing": "65.00",
  "totalPages": "297",
  "binding": "平装",
  "suitFlag": false
}